[
  {
    "id": "harvard-cs50x",
    "title": "CS50's Introduction to Computer Science",
    "provider": "Harvard University / CS50",
    "category": "computer-science",
    "level": "beginner",
    "primary_language": "en",
    "other_languages": [],
    "url": "https://cs50.harvard.edu/x/",
    "free_access": "F0_FULL_CREDENTIAL",
    "certificate": "free_provider_certificate",
    "academic_credits": "optional_paid_or_external",
    "self_paced": true,
    "status": "active",
    "quality_components": {
      "pedagogy": 10,
      "depth": 9.6,
      "practice": 9.9,
      "materials": 10,
      "currency": 10,
      "expertise": 10,
      "accessibility": 9.5
    },
    "recommendation_score": 9.9,
    "why_recommended": "Reference-quality introduction to computer science with demanding problem sets, broad fundamentals, and a final project.",
    "evidence": [
      "https://cs50.harvard.edu/x/",
      "https://cs50.harvard.edu/x/certificate/"
    ],
    "last_verified": "2026-09-09",
    "review_status": "reference_verified",
    "quality_score": 9.88,
    "review_interval_days": 90,
    "next_review": "2026-12-08"
  },
  {
    "id": "harvard-cs50p",
    "title": "CS50's Introduction to Programming with Python",
    "provider": "Harvard University / CS50",
    "category": "computer-science",
    "level": "beginner",
    "primary_language": "en",
    "other_languages": [],
    "url": "https://cs50.harvard.edu/python/",
    "free_access": "F0_FULL_CREDENTIAL",
    "certificate": "free_provider_certificate",
    "academic_credits": "none_by_default",
    "self_paced": true,
    "status": "active",
    "quality_components": {
      "pedagogy": 9.9,
      "depth": 9,
      "practice": 9.8,
      "materials": 9.8,
      "currency": 9.8,
      "expertise": 10,
      "accessibility": 9.7
    },
    "recommendation_score": 9.6,
    "why_recommended": "One of the strongest structured Python introductions, with graded problems and a substantive final project.",
    "evidence": [
      "https://cs50.harvard.edu/python/",
      "https://cs50.harvard.edu/python/certificate/"
    ],
    "last_verified": "2026-09-09",
    "review_status": "reference_verified",
    "quality_score": 9.68,
    "review_interval_days": 90,
    "next_review": "2026-12-08"
  },
  {
    "id": "harvard-cs50-ai",
    "title": "CS50's Introduction to Artificial Intelligence with Python",
    "provider": "Harvard University / CS50",
    "category": "ai-data",
    "level": "intermediate",
    "primary_language": "en",
    "other_languages": [],
    "url": "https://cs50.harvard.edu/ai/",
    "free_access": "F0_FULL_CREDENTIAL",
    "certificate": "free_provider_certificate",
    "academic_credits": "none_by_default",
    "self_paced": true,
    "status": "active",
    "quality_components": {
      "pedagogy": 9.8,
      "depth": 9.4,
      "practice": 9.8,
      "materials": 9.7,
      "currency": 9.2,
      "expertise": 10,
      "accessibility": 8.8
    },
    "recommendation_score": 9.7,
    "why_recommended": "Project-heavy AI foundations spanning search, optimisation, machine learning, neural networks and language.",
    "evidence": [
      "https://cs50.harvard.edu/ai/",
      "https://cs50.harvard.edu/ai/certificate/"
    ],
    "last_verified": "2026-09-09",
    "review_status": "reference_verified",
    "quality_score": 9.62,
    "review_interval_days": 90,
    "next_review": "2026-12-08"
  },
  {
    "id": "harvard-cs50-sql",
    "title": "CS50's Introduction to Databases with SQL",
    "provider": "Harvard University / CS50",
    "category": "computer-science",
    "level": "beginner",
    "primary_language": "en",
    "other_languages": [],
    "url": "https://cs50.harvard.edu/sql/",
    "free_access": "F0_FULL_CREDENTIAL",
    "certificate": "free_provider_certificate",
    "academic_credits": "optional_paid_or_external",
    "self_paced": true,
    "status": "active",
    "quality_components": {
      "pedagogy": 9.7,
      "depth": 9.1,
      "practice": 9.7,
      "materials": 9.7,
      "currency": 9.7,
      "expertise": 9.8,
      "accessibility": 9.6
    },
    "recommendation_score": 9.6,
    "why_recommended": "Excellent database fundamentals from querying and schema design through indexing, optimisation and scaling.",
    "evidence": [
      "https://cs50.harvard.edu/sql/",
      "https://cs50.harvard.edu/sql/certificate/"
    ],
    "last_verified": "2026-09-09",
    "review_status": "reference_verified",
    "quality_score": 9.58,
    "review_interval_days": 90,
    "next_review": "2026-12-08"
  },
  {
    "id": "helsinki-full-stack-open",
    "title": "Full Stack Open",
    "provider": "University of Helsinki",
    "category": "computer-science",
    "level": "intermediate",
    "primary_language": "en",
    "other_languages": [],
    "url": "https://fullstackopen.com/en/",
    "free_access": "F0_FULL_CREDENTIAL",
    "certificate": "free_provider_certificate",
    "academic_credits": "free_ects_available",
    "self_paced": true,
    "status": "active",
    "quality_components": {
      "pedagogy": 9.5,
      "depth": 9.6,
      "practice": 10,
      "materials": 9.7,
      "currency": 9.8,
      "expertise": 9.6,
      "accessibility": 8.8
    },
    "recommendation_score": 9.9,
    "why_recommended": "Exceptionally practical modern web-development curriculum with React, Node.js, testing, TypeScript, CI/CD and more.",
    "evidence": [
      "https://fullstackopen.com/en/about/"
    ],
    "last_verified": "2026-09-09",
    "review_status": "reference_verified",
    "quality_score": 9.64,
    "review_interval_days": 90,
    "next_review": "2026-12-08"
  },
  {
    "id": "helsinki-python-mooc-2026",
    "title": "Python Programming MOOC 2026",
    "provider": "University of Helsinki",
    "category": "computer-science",
    "level": "beginner_to_intermediate",
    "primary_language": "en",
    "other_languages": [],
    "url": "https://programming-26.mooc.fi/",
    "free_access": "F0_FULL_CREDENTIAL",
    "certificate": "academic_completion_route",
    "academic_credits": "free_ects_available_subject_to_rules",
    "self_paced": false,
    "status": "active",
    "quality_components": {
      "pedagogy": 9.6,
      "depth": 9.5,
      "practice": 10,
      "materials": 9.6,
      "currency": 10,
      "expertise": 9.6,
      "accessibility": 9
    },
    "recommendation_score": 9.7,
    "why_recommended": "Large exercise-driven sequence corresponding to Helsinki's introductory and advanced programming courses (5+5 ECTS).",
    "evidence": [
      "https://programming-26.mooc.fi/"
    ],
    "last_verified": "2026-09-09",
    "review_status": "reference_verified",
    "quality_score": 9.67,
    "review_interval_days": 60,
    "next_review": "2026-11-08"
  },
  {
    "id": "portswigger-web-security-academy",
    "title": "Web Security Academy",
    "provider": "PortSwigger",
    "category": "cybersecurity-it",
    "level": "beginner_to_advanced",
    "primary_language": "en",
    "other_languages": [],
    "url": "https://portswigger.net/web-security",
    "free_access": "F1_FULL_ASSESSMENTS",
    "certificate": "paid_external_exam_only",
    "academic_credits": "none",
    "self_paced": true,
    "status": "active",
    "quality_components": {
      "pedagogy": 9.7,
      "depth": 10,
      "practice": 10,
      "materials": 10,
      "currency": 10,
      "expertise": 10,
      "accessibility": 9.5
    },
    "recommendation_score": 9.9,
    "why_recommended": "Continuously updated web-security training with extensive interactive labs and structured learning paths.",
    "evidence": [
      "https://portswigger.net/web-security",
      "https://portswigger.net/web-security/learning-paths"
    ],
    "last_verified": "2026-09-09",
    "review_status": "reference_verified",
    "quality_score": 9.9,
    "review_interval_days": 90,
    "next_review": "2026-12-08"
  },
  {
    "id": "google-ml-crash-course",
    "title": "Machine Learning Crash Course",
    "provider": "Google for Developers",
    "category": "ai-data",
    "level": "beginner_to_intermediate",
    "primary_language": "en",
    "other_languages": [
      "pt-BR"
    ],
    "url": "https://developers.google.com/machine-learning/crash-course",
    "free_access": "F1_FULL_ASSESSMENTS",
    "certificate": "none",
    "academic_credits": "none",
    "self_paced": true,
    "status": "active",
    "quality_components": {
      "pedagogy": 9.4,
      "depth": 8.9,
      "practice": 9.4,
      "materials": 9.6,
      "currency": 10,
      "expertise": 9.8,
      "accessibility": 9.7
    },
    "recommendation_score": 9.5,
    "why_recommended": "Current, compact and highly interactive ML foundation with browser exercises, production topics, LLMs and fairness.",
    "evidence": [
      "https://developers.google.com/machine-learning/crash-course",
      "https://developers.google.com/machine-learning/crash-course/exercises"
    ],
    "last_verified": "2026-09-09",
    "review_status": "reference_verified",
    "quality_score": 9.44,
    "review_interval_days": 90,
    "next_review": "2026-12-08"
  },
  {
    "id": "mit-18-06sc-linear-algebra",
    "title": "18.06SC Linear Algebra",
    "provider": "MIT OpenCourseWare",
    "category": "math-statistics",
    "level": "undergraduate",
    "primary_language": "en",
    "other_languages": [],
    "url": "https://ocw.mit.edu/courses/18-06sc-linear-algebra-fall-2011/",
    "free_access": "F2_CONTENT_ONLY",
    "certificate": "none",
    "academic_credits": "none",
    "self_paced": true,
    "status": "active_archive",
    "quality_components": {
      "pedagogy": 10,
      "depth": 10,
      "practice": 9.5,
      "materials": 10,
      "currency": 8.8,
      "expertise": 10,
      "accessibility": 9.2
    },
    "recommendation_score": 9.6,
    "why_recommended": "Gilbert Strang's canonical linear algebra course with lectures, exercises, exams and self-study materials.",
    "evidence": [